{
  "schemaVersion": "1.0.0",
  "id": "sample-ai-tutorial",
  "title": "Build Reliable AI Tutorials",
  "description": "A compact sample specification for an end-to-end tutorial on creating reliable AI-generated lessons.",
  "audience": {
    "primary": "Technical educators and developer advocates",
    "priorKnowledge": ["Basic Markdown", "Introductory TypeScript"],
    "roles": ["curriculum designer", "developer educator"],
    "readingLevel": "Upper secondary or higher"
  },
  "prerequisites": ["Can edit MDX files", "Can run pnpm scripts locally"],
  "learningObjectives": [
    {
      "id": "obj-classify-claims",
      "description": "Classify generated claims as verified, verify, or unsupported based on available evidence.",
      "bloomLevel": "analyze",
      "assessmentIds": ["assess-classification"]
    },
    {
      "id": "obj-map-evidence",
      "description": "Map each claim to its supporting citation or to a source-plan task.",
      "bloomLevel": "apply",
      "assessmentIds": ["assess-evidence-mapping"]
    },
    {
      "id": "obj-decide-action",
      "description": "Decide whether to publish, mark for verification, or remove each claim.",
      "bloomLevel": "evaluate",
      "assessmentIds": ["assess-publish-decision"]
    }
  ],
  "scope": {
    "inScope": ["Tutorial specification", "MDX artifacts", "Validation gates"],
    "nonGoals": ["Replacing human subject-matter review", "Generating production claims without sources"]
  },
  "lessons": [
    {
      "id": "lesson-quality-foundation",
      "slug": "01-sample-lesson",
      "title": "Classify Claims and Map Evidence",
      "summary": "Classify generated claims, map each to evidence, and decide whether to publish, verify, or remove.",
      "estimatedMinutes": 10,
      "difficulty": "beginner",
      "prerequisites": ["Can read JSON"],
      "objectiveIds": ["obj-classify-claims", "obj-map-evidence", "obj-decide-action"],
      "conceptIds": ["concept-quality-gate", "concept-claim-state"],
      "referenceIds": ["ref-wcag", "ref-mdx"],
      "artifacts": {
        "mdxPath": "content/module-1/01-sample-lesson.mdx",
        "slidesPath": "presentations/00-sample-deck.md"
      }
    }
  ],
  "references": [
    {
      "id": "ref-wcag",
      "title": "Web Content Accessibility Guidelines",
      "url": "https://www.w3.org/TR/WCAG22/",
      "publisher": "W3C",
      "accessedAt": "2026-06-19",
      "quality": "primary"
    },
    {
      "id": "ref-mdx",
      "title": "MDX Documentation",
      "url": "https://mdxjs.com/",
      "publisher": "MDX",
      "accessedAt": "2026-06-19",
      "quality": "official-docs"
    }
  ],
  "concepts": [
    {
      "id": "concept-quality-gate",
      "term": "Quality gate",
      "definition": "A deterministic check that generated content must pass before publication.",
      "relatedConceptIds": ["concept-claim-state"]
    },
    {
      "id": "concept-claim-state",
      "term": "Claim state",
      "definition": "A label indicating whether a factual statement is verified, needs verification, or is unsupported."
    }
  ],
  "misconceptions": [
    {
      "id": "mis-ai-is-review",
      "misconception": "A model-generated lesson is ready when it sounds polished.",
      "correction": "Generated content still needs schema validation, source checks, accessibility checks, and human review.",
      "conceptIds": ["concept-quality-gate"]
    }
  ],
  "workedExamples": [
    {
      "id": "example-classify-popularity",
      "title": "Classify a popularity claim",
      "prompt": "A generated lesson says 'Library X is the recommended option for new projects' but the source plan has no citation.",
      "steps": [
        "Check the source plan — no citation is listed for this claim.",
        "The claim is plausible but 'recommended' implies consensus that may not exist.",
        "Classify as verify.",
        "Add a source-plan entry to find a recent, authoritative comparison.",
        "Wrap the claim in a VerifyClaim component with status='verify'."
      ],
      "explanation": "The verify state keeps plausible claims visible for review rather than silently publishing or removing them.",
      "conceptIds": ["concept-claim-state"],
      "referenceIds": ["ref-mdx"]
    }
  ],
  "exercises": [
    {
      "id": "exercise-classify-claims",
      "prompt": "Classify three claims (WCAG requirement with source, screen-reader statistic without source, browser rendering guarantee without source) and decide: publish, verify, or remove.",
      "type": "scenario",
      "difficulty": "beginner",
      "conceptIds": ["concept-claim-state", "concept-quality-gate"],
      "answerId": "answer-classify-claims"
    }
  ],
  "answers": [
    {
      "id": "answer-classify-claims",
      "exerciseId": "exercise-classify-claims",
      "answer": "Claim A (WCAG requirement): verified — publish with citation. Claim B (screen-reader statistic): verify — add source-plan task. Claim C (identical rendering): unsupported — remove.",
      "rubric": ["Correctly identifies all three claim states", "Justifies each decision with evidence reasoning"]
    }
  ],
  "formativeAssessment": [
    {
      "id": "assess-classification",
      "type": "quiz",
      "prompt": "A generated lesson states a tool is the most popular but cites no source. What is the correct classification?",
      "expectedAnswer": "verify — the claim is plausible but lacks a cited source. Add a source-plan task.",
      "objectiveIds": ["obj-classify-claims"]
    },
    {
      "id": "assess-evidence-mapping",
      "type": "free-response",
      "prompt": "After classifying a claim as verify, what two actions should you take?",
      "expectedAnswer": "Add a citation task to the source plan and wrap the claim in a VerifyClaim component in the MDX.",
      "objectiveIds": ["obj-map-evidence"]
    },
    {
      "id": "assess-publish-decision",
      "type": "quiz",
      "prompt": "When should you remove a claim rather than marking it for verification?",
      "expectedAnswer": "When no credible source is likely to exist or the claim contradicts established facts.",
      "objectiveIds": ["obj-decide-action"]
    }
  ],
  "masteryCriteria": [
    {
      "id": "mastery-classify",
      "description": "Can classify claims as verified, verify, or unsupported based on evidence availability.",
      "objectiveIds": ["obj-classify-claims"],
      "threshold": "Correctly classifies four out of five sample claims."
    },
    {
      "id": "mastery-evidence",
      "description": "Can map each classified claim to a citation or source-plan task.",
      "objectiveIds": ["obj-map-evidence"],
      "threshold": "Produces a complete evidence map for a set of three claims."
    },
    {
      "id": "mastery-decision",
      "description": "Can justify publish, verify, or remove decisions for each claim.",
      "objectiveIds": ["obj-decide-action"],
      "threshold": "Correctly decides and justifies action for four out of five claims."
    }
  ],
  "recap": ["Use structured specs to constrain generation.", "Treat citations and verification states as required content, not polish."],
  "nextSteps": ["Author a source plan for a real tutorial.", "Run pnpm validate before requesting review."],
  "accessibility": {
    "altTextRequired": true,
    "captionsRequired": true,
    "transcriptRequired": true,
    "colorIndependent": true,
    "keyboardNavigable": true,
    "readingOrderChecked": true
  },
  "localization": {
    "sourceLocale": "en-US",
    "targetLocales": ["en-GB"],
    "glossaryTerms": ["quality gate", "claim state"],
    "culturalAssumptions": ["Examples assume familiarity with command-line development."]
  }
}
